{
  "type": "bark_pool",
  "owner_id": "char.henning",
  "confidence": "invented",
  "canon_status": "draft",
  "approval": {
    "status": "review",
    "notes": "P4-017 district pressure bark pool."
  },
  "deterministic_offline": {
    "authored": true,
    "runtime_llm_allowed": false,
    "free_text_input_allowed": false,
    "selection": "first_valid_in_order"
  },
  "selection": "first_valid_in_order",
  "phase_ids": [
    "phase.investigation_morning",
    "phase.investigation_night",
    "phase.consequence_night"
  ],
  "entries": [
    {
      "id": "relaxed",
      "speaker_id": "char.henning",
      "text": "The watch nods and keeps a wide berth around the forge.",
      "priority": 1
    }
  ],
  "source_notes": [
    {
      "confidence": "invented",
      "summary": "District-pressure patrol bark tier.",
      "citations": [
        "scripts/faction/district_pressure_model.gd"
      ]
    }
  ],
  "id": "bark.district.lower_town.relaxed",
  "title": "Lower Town watch (relaxed)",
  "location_ids": [
    "loc.lower_town_slice"
  ]
}
